Code,Libellé
"temp_1_1","En contrat d'apprentissage ou de professionnalisation"
"temp_1_2","Placés par une agence d'intérim"
"temp_1_3","Emplois aidés (contrat unique d'insertion, d'initiative emploi, d'accompagnement dans l'emploi, avenir, etc.)"
"temp_1_4","Stagiaires rémunérés en entreprise"
"temp_1_5","Autres emplois à durée limitée, CDD, contrat court, saisonnier, vacataire, etc."
"temp_1_6","Emplois sans limite de durée, CDI, titulaire de la fonction publique"
"temp_2_1","Non salariés : Indépendants"
"temp_2_2","Non salariés : Employeurs"
"temp_2_3","Non salariés : Aides familiaux"
